{
  "schema_version": "1.1",
  "document": "atpg_report",
  "circuit": "c499",
  "fault_model": "stuck_at",
  "algorithm": "podem",
  "pi_order": [
    "1",
    "5",
    "9",
    "13",
    "17",
    "21",
    "25",
    "29",
    "33",
    "37",
    "41",
    "45",
    "49",
    "53",
    "57",
    "61",
    "65",
    "69",
    "73",
    "77",
    "81",
    "85",
    "89",
    "93",
    "97",
    "101",
    "105",
    "109",
    "113",
    "117",
    "121",
    "125",
    "129",
    "130",
    "131",
    "132",
    "133",
    "134",
    "135",
    "136",
    "137"
  ],
  "summary": {
    "total_faults": 758,
    "detected": 750,
    "redundant": 0,
    "aborted": 8,
    "patterns": 138,
    "sat_patterns": 0,
    "weighted_coverage_pct": 99.2,
    "weighted_efficiency_pct": 99.2
  },
  "patterns": [
    {
      "index": 0,
      "bits": "10000000000000010000000000000000000000000",
      "cube": "1000000000000001000000000000000000000X0XX"
    },
    {
      "index": 1,
      "bits": "00000000000000010000000000000000000000000",
      "cube": "0000000000000001000000000000000000000X0XX"
    },
    {
      "index": 2,
      "bits": "10000000000000000001000000000000100000001",
      "cube": "10000000000000000001000000000000100000001"
    },
    {
      "index": 3,
      "bits": "10010000000000000000000000000000000010101",
      "cube": "10010000000000000000000000000000000010101"
    },
    {
      "index": 4,
      "bits": "01000000000000010000000000000000000000000",
      "cube": "0100000000000001000000000000000000000X0XX"
    },
    {
      "index": 5,
      "bits": "01000000000000000001000000000000010000001",
      "cube": "01000000000000000001000000000000010000001"
    },
    {
      "index": 6,
      "bits": "01010000000000000000000000000000000010101",
      "cube": "01010000000000000000000000000000000010101"
    },
    {
      "index": 7,
      "bits": "00100000000000010000000000000000000000000",
      "cube": "0010000000000001000000000000000000000X0XX"
    },
    {
      "index": 8,
      "bits": "00100000000000000001000000000000001000001",
      "cube": "00100000000000000001000000000000001000001"
    },
    {
      "index": 9,
      "bits": "00110000000000000000000000000000000010101",
      "cube": "00110000000000000000000000000000000010101"
    },
    {
      "index": 10,
      "bits": "00010000000000000001000000000000000100001",
      "cube": "00010000000000000001000000000000000100001"
    },
    {
      "index": 11,
      "bits": "00001000000100000000000000000000000000000",
      "cube": "0000100000010000000000000000000000000XX0X"
    },
    {
      "index": 12,
      "bits": "00001000000000000010000000000000100000001",
      "cube": "00001000000000000010000000000000100000001"
    },
    {
      "index": 13,
      "bits": "00011000000000000000000000000000000010011",
      "cube": "00011000000000000000000000000000000010011"
    },
    {
      "index": 14,
      "bits": "00000100000100000000000000000000000000000",
      "cube": "0000010000010000000000000000000000000XX0X"
    },
    {
      "index": 15,
      "bits": "00000100000000000010000000000000010000001",
      "cube": "00000100000000000010000000000000010000001"
    },
    {
      "index": 16,
      "bits": "00010100000000000000000000000000000010011",
      "cube": "00010100000000000000000000000000000010011"
    },
    {
      "index": 17,
      "bits": "00000010000100000000000000000000000000000",
      "cube": "0000001000010000000000000000000000000XX0X"
    },
    {
      "index": 18,
      "bits": "00000010000000000010000000000000001000001",
      "cube": "00000010000000000010000000000000001000001"
    },
    {
      "index": 19,
      "bits": "00010010000000000000000000000000000010011",
      "cube": "00010010000000000000000000000000000010011"
    },
    {
      "index": 20,
      "bits": "00000001000000000000000000000000000000101",
      "cube": "00000001000000000000000000000000000000101"
    },
    {
      "index": 21,
      "bits": "00000001000000000010000000000000000100001",
      "cube": "00000001000000000010000000000000000100001"
    },
    {
      "index": 22,
      "bits": "00000001000000000000000000000000000000111",
      "cube": "00000001000000000000000000000000000000111"
    },
    {
      "index": 23,
      "bits": "00000001100000000000000000000000000000000",
      "cube": "000000011000000000000000000000000000X00XX"
    },
    {
      "index": 24,
      "bits": "00000000100000000001000000000000100000001",
      "cube": "00000000100000000001000000000000100000001"
    },
    {
      "index": 25,
      "bits": "00010000100000000000000000000000000001101",
      "cube": "00010000100000000000000000000000000001101"
    },
    {
      "index": 26,
      "bits": "00000001010000000000000000000000000000000",
      "cube": "000000010100000000000000000000000000X00XX"
    },
    {
      "index": 27,
      "bits": "00000000010000000001000000000000010000001",
      "cube": "00000000010000000001000000000000010000001"
    },
    {
      "index": 28,
      "bits": "00010000010000000000000000000000000001101",
      "cube": "00010000010000000000000000000000000001101"
    },
    {
      "index": 29,
      "bits": "00000001001000000000000000000000000000000",
      "cube": "000000010010000000000000000000000000X00XX"
    },
    {
      "index": 30,
      "bits": "00000000001000000001000000000000001000001",
      "cube": "00000000001000000001000000000000001000001"
    },
    {
      "index": 31,
      "bits": "00010000001000000000000000000000000001101",
      "cube": "00010000001000000000000000000000000001101"
    },
    {
      "index": 32,
      "bits": "00000000000100000001000000000000000100001",
      "cube": "00000000000100000001000000000000000100001"
    },
    {
      "index": 33,
      "bits": "00000000000100000000000000000000000011001",
      "cube": "00000000000100000000000000000000000011001"
    },
    {
      "index": 34,
      "bits": "00010000000010000000000000000000000000000",
      "cube": "000100000000100000000000000000000000X0X0X"
    },
    {
      "index": 35,
      "bits": "00000000000010000010000000000000100000001",
      "cube": "00000000000010000010000000000000100000001"
    },
    {
      "index": 36,
      "bits": "00010000000010000000000000000000000001011",
      "cube": "00010000000010000000000000000000000001011"
    },
    {
      "index": 37,
      "bits": "00010000000001000000000000000000000000000",
      "cube": "000100000000010000000000000000000000X0X0X"
    },
    {
      "index": 38,
      "bits": "00000000000001000010000000000000010000001",
      "cube": "00000000000001000010000000000000010000001"
    },
    {
      "index": 39,
      "bits": "00010000000001000000000000000000000001011",
      "cube": "00010000000001000000000000000000000001011"
    },
    {
      "index": 40,
      "bits": "00010000000000100000000000000000000000000",
      "cube": "000100000000001000000000000000000000X0X0X"
    },
    {
      "index": 41,
      "bits": "00000000000000100010000000000000001000001",
      "cube": "00000000000000100010000000000000001000001"
    },
    {
      "index": 42,
      "bits": "00010000000000100000000000000000000001011",
      "cube": "00010000000000100000000000000000000001011"
    },
    {
      "index": 43,
      "bits": "00000000000100001000000000000000000000000",
      "cube": "0000000000010000100000000000000000000XXXX"
    },
    {
      "index": 44,
      "bits": "00010000000000001000000000000000000010001",
      "cube": "00010000000000001000000000000000000010001"
    },
    {
      "index": 45,
      "bits": "00000000000000001001000000000000000100001",
      "cube": "00000000000000001001000000000000000100001"
    },
    {
      "index": 46,
      "bits": "00010000000000000100000000000000000000000",
      "cube": "000100000000000001000000000000000000X0XXX"
    },
    {
      "index": 47,
      "bits": "00010000000000000100000000000000000001001",
      "cube": "00010000000000000100000000000000000001001"
    },
    {
      "index": 48,
      "bits": "00000000000000000101000000000000000100001",
      "cube": "00000000000000000101000000000000000100001"
    },
    {
      "index": 49,
      "bits": "00010000000000000010000000000000000000101",
      "cube": "00010000000000000010000000000000000000101"
    },
    {
      "index": 50,
      "bits": "00000000000000000011000000000000101000001",
      "cube": "00000000000000000011000000000000101000001"
    },
    {
      "index": 51,
      "bits": "00000000001000000000100000000000000000000",
      "cube": "0000000000100000000010000000000000000XXXX"
    },
    {
      "index": 52,
      "bits": "00100000000000000000100000000000000010001",
      "cube": "00100000000000000000100000000000000010001"
    },
    {
      "index": 53,
      "bits": "00000000000000000001100000000000001000001",
      "cube": "00000000000000000001100000000000001000001"
    },
    {
      "index": 54,
      "bits": "00100000000000000000010000000000000000000",
      "cube": "001000000000000000000100000000000000X0XXX"
    },
    {
      "index": 55,
      "bits": "00100000000000000000010000000000000001001",
      "cube": "00100000000000000000010000000000000001001"
    },
    {
      "index": 56,
      "bits": "00000000000000000001010000000000001000001",
      "cube": "00000000000000000001010000000000001000001"
    },
    {
      "index": 57,
      "bits": "00000010000000000000001000000000000000000",
      "cube": "000000100000000000000010000000000000XX0XX"
    },
    {
      "index": 58,
      "bits": "00100000000000000000001000000000000000101",
      "cube": "00100000000000000000001000000000000000101"
    },
    {
      "index": 59,
      "bits": "00000000000000000001001000000000100100001",
      "cube": "00000000000000000001001000000000100100001"
    },
    {
      "index": 60,
      "bits": "00100000000000000000000100000000000000000",
      "cube": "001000000000000000000001000000000000XXX0X"
    },
    {
      "index": 61,
      "bits": "00100000000000000000000100000000000000011",